"about","active_tech_count","address","apptopia/0/image","apptopia/0/monthly_downloads","apptopia/0/name","apptopia/0/stores/0","apptopia/1/image","apptopia/1/monthly_downloads","apptopia/1/name","apptopia/1/stores/0","apptopia/2/image","apptopia/2/monthly_downloads","apptopia/2/name","apptopia/2/stores/0","apptopia/3/image","apptopia/3/monthly_downloads","apptopia/3/name","apptopia/3/stores/0","apptopia/4/image","apptopia/4/monthly_downloads","apptopia/4/name","apptopia/4/stores/0","apptopia/5/image","apptopia/5/monthly_downloads","apptopia/5/name","apptopia/5/stores/0","apptopia/6/image","apptopia/6/monthly_downloads","apptopia/6/name","apptopia/6/stores/0","apptopia/7/image","apptopia/7/monthly_downloads","apptopia/7/name","apptopia/7/stores/0","apptopia/8/image","apptopia/8/monthly_downloads","apptopia/8/name","apptopia/8/stores/0","apptopia/9/image","apptopia/9/monthly_downloads","apptopia/9/name","apptopia/9/stores/0","apptopia_total_downloads","apptopia_total_downloads_mom_pct","bombora/0/category","bombora/0/score","bombora/0/topic","bombora/0/weeks_surging","bombora/0/wow_growth","bombora/1/category","bombora/1/score","bombora/1/topic","bombora/1/weeks_surging","bombora/1/wow_growth","bombora/2/category","bombora/2/score","bombora/2/topic","bombora/2/weeks_surging","bombora/2/wow_growth","bombora/3/category","bombora/3/score","bombora/3/topic","bombora/3/weeks_surging","bombora/3/wow_growth","bombora/4/category","bombora/4/score","bombora/4/topic","bombora/4/weeks_surging","bombora/4/wow_growth","bombora/5/category","bombora/5/score","bombora/5/topic","bombora/5/weeks_surging","bombora/5/wow_growth","bombora/6/category","bombora/6/score","bombora/6/topic","bombora/6/weeks_surging","bombora/6/wow_growth","bombora/7/category","bombora/7/score","bombora/7/topic","bombora/7/weeks_surging","bombora/7/wow_growth","bombora/8/category","bombora/8/score","bombora/8/topic","bombora/8/weeks_surging","bombora/8/wow_growth","bombora/9/category","bombora/9/score","bombora/9/topic","bombora/9/weeks_surging","bombora/9/wow_growth","bombora_last_updated","built_with_num_technologies_used","built_with_tech/0/name","built_with_tech/0/num_companies_using","built_with_tech/0/technology_category/0","built_with_tech/1/name","built_with_tech/1/num_companies_using","built_with_tech/1/technology_category/0","built_with_tech/2/name","built_with_tech/2/num_companies_using","built_with_tech/2/technology_category/0","built_with_tech/3/name","built_with_tech/3/num_companies_using","built_with_tech/3/technology_category/0","built_with_tech/4/name","built_with_tech/4/num_companies_using","built_with_tech/4/technology_category/0","built_with_tech/5/name","built_with_tech/5/num_companies_using","built_with_tech/5/technology_category/0","built_with_tech/6/name","built_with_tech/6/num_companies_using","built_with_tech/6/technology_category/0","built_with_tech/7/name","built_with_tech/7/num_companies_using","built_with_tech/7/technology_category/0","built_with_tech/8/name","built_with_tech/8/num_companies_using","built_with_tech/8/technology_category/0","built_with_tech/9/name","built_with_tech/9/num_companies_using","built_with_tech/9/technology_category/0","builtwith_num_technologies_used","builtwith_tech/0/name","builtwith_tech/0/num_companies_using","builtwith_tech/0/technology_category/0","builtwith_tech/1/name","builtwith_tech/1/num_companies_using","builtwith_tech/1/technology_category/0","builtwith_tech/2/name","builtwith_tech/2/num_companies_using","builtwith_tech/2/technology_category/0","builtwith_tech/3/name","builtwith_tech/3/num_companies_using","builtwith_tech/3/technology_category/0","builtwith_tech/4/name","builtwith_tech/4/num_companies_using","builtwith_tech/4/technology_category/0","builtwith_tech/5/name","builtwith_tech/5/num_companies_using","builtwith_tech/5/technology_category/0","builtwith_tech/6/name","builtwith_tech/6/num_companies_using","builtwith_tech/6/technology_category/0","builtwith_tech/7/name","builtwith_tech/7/num_companies_using","builtwith_tech/7/technology_category/0","builtwith_tech/8/name","builtwith_tech/8/num_companies_using","builtwith_tech/8/technology_category/0","builtwith_tech/9/name","builtwith_tech/9/num_companies_using","builtwith_tech/9/technology_category/0","cb_rank","company_activity_level","company_id","company_industry","company_overview","company_type","contact_email","contact_phone","contacts/0/job_title","contacts/0/name","contacts/1/job_title","contacts/1/name","contacts/2/job_title","contacts/2/name","contacts/3/job_title","contacts/3/name","contacts/4/job_title","contacts/4/name","contacts/5/job_title","contacts/5/name","contacts/6/job_title","contacts/6/name","contacts/7/job_title","contacts/7/name","country_code","current_employees/0/name","current_employees/0/permalink","current_employees/0/title","current_employees/1/name","current_employees/1/permalink","current_employees/1/title","current_employees/2/name","current_employees/2/permalink","current_employees/2/title","current_employees/3/name","current_employees/3/permalink","current_employees/3/title","current_employees/4/name","current_employees/4/permalink","current_employees/4/title","current_employees/5/name","current_employees/5/permalink","current_employees/5/title","current_employees/6/name","current_employees/6/permalink","current_employees/6/title","current_employees/7/name","current_employees/7/permalink","current_employees/7/title","email_address","featured_list/0/org_funding_total/currency","featured_list/0/org_funding_total/formatted_value","featured_list/0/org_funding_total/value","featured_list/0/org_funding_total/value_usd","featured_list/0/org_num","featured_list/0/org_num_investors","featured_list/0/title","featured_list/1/org_funding_total/currency","featured_list/1/org_funding_total/formatted_value","featured_list/1/org_funding_total/value","featured_list/1/org_funding_total/value_usd","featured_list/1/org_num","featured_list/1/org_num_investors","featured_list/1/title","featured_list/2/org_funding_total/currency","featured_list/2/org_funding_total/formatted_value","featured_list/2/org_funding_total/value","featured_list/2/org_funding_total/value_usd","featured_list/2/org_num","featured_list/2/org_num_investors","featured_list/2/title","featured_list/3/org_funding_total/currency","featured_list/3/org_funding_total/formatted_value","featured_list/3/org_funding_total/value","featured_list/3/org_funding_total/value_usd","featured_list/3/org_num","featured_list/3/org_num_investors","featured_list/3/title","financials_highlights/num_investors","financials_highlights/num_lead_investors","founders/0/id","founders/0/type","founders/0/value","full_description","funds_raised/0/id","funds_raised/0/type","funds_raised/0/value","funds_raised/1/id","funds_raised/1/type","funds_raised/1/value","funds_raised/2/id","funds_raised/2/type","funds_raised/2/value","growth_score","growth_trend","headquarters_regions/0/id","headquarters_regions/0/value","heat_score","heat_trend","hq_continent","id","image","industries/0/id","industries/0/value","industries/1/id","industries/1/value","industries/2/id","industries/2/value","input/url","investments/0/funding_round/id","investments/0/funding_round/image_id","investments/0/funding_round/type","investments/0/funding_round/value","investments/0/id","investments/0/lead_investor","investments/0/organization/id","investments/0/organization/image_id","investments/0/organization/type","investments/0/organization/value","investments/0/type","investments/0/value","investments/1/funding_round/id","investments/1/funding_round/image_id","investments/1/funding_round/type","investments/1/funding_round/value","investments/1/id","investments/1/lead_investor","investments/1/organization/id","investments/1/organization/image_id","investments/1/organization/type","investments/1/organization/value","investments/1/type","investments/1/value","investments/2/funding_round/id","investments/2/funding_round/image_id","investments/2/funding_round/type","investments/2/funding_round/value","investments/2/id","investments/2/lead_investor","investments/2/organization/id","investments/2/organization/image_id","investments/2/organization/type","investments/2/organization/value","investments/2/type","investments/2/value","investors/0/funding_round/id","investors/0/funding_round/image_id","investors/0/funding_round/type","investors/0/funding_round/value","investors/0/id","investors/0/investor/id","investors/0/investor/image_id","investors/0/investor/type","investors/0/investor/value","investors/0/lead_investor","investors/0/type","investors/0/value","ipo_fields/stock_link","ipo_fields/stock_symbol","ipo_status","ipqwery/ipqwery_num_patent_granted","ipqwery/ipqwery_num_trademark_registered","ipqwery/ipqwery_popular_trademark_class","ipqwery/trademark_class_text","legal_name","location/0/name","location/0/permalink","location/1/name","location/1/permalink","location/2/name","location/2/permalink","location/3/name","location/3/permalink","monthly_visits","monthly_visits_growth","name","news/0/date","news/0/organization","news/1/date","news/1/organization","news/2/date","news/2/organization","news/3/date","news/3/organization","news/4/date","news/4/organization","news/5/date","news/5/organization","news/6/date","news/6/organization","news/7/date","news/7/organization","news/8/date","news/8/organization","news/9/date","news/9/organization","num_employee_profiles","num_employees","num_investments","num_investors","number_of_employee_profiles","number_of_funds","number_of_investments","number_of_investors","operating_status","people_highlights/num_current_positions","phone_number","products_and_services/0/product_description","products_and_services/0/product_name","products_and_services/1/product_description","products_and_services/1/product_name","products_and_services/2/product_description","products_and_services/2/product_name","products_and_services/3/product_description","products_and_services/3/product_name","products_and_services/4/product_description","products_and_services/4/product_name","products_and_services/5/product_description","products_and_services/5/product_name","region","semrush_last_updated","semrush_visits_latest_month","semrush_visits_mom_pct","siftery_products/0/status","siftery_products/0/title","siftery_products/1/status","siftery_products/1/title","siftery_products/2/status","siftery_products/2/title","siftery_products/3/status","siftery_products/3/title","similar_companies/0/link","similar_companies/0/name","similar_companies/1/link","similar_companies/1/name","similar_companies/2/link","similar_companies/2/name","similar_companies/3/link","similar_companies/3/name","similar_companies/4/link","similar_companies/4/name","similar_companies/5/link","similar_companies/5/name","similar_companies/6/link","similar_companies/6/name","similar_companies/7/link","similar_companies/7/name","similar_companies/8/link","similar_companies/8/name","similar_companies/9/link","similar_companies/9/name","social_media_links/0","socila_media_urls/0","technology_highlights/builtwith_num_technologies_used","technology_highlights/semrush_visits_latest_month","technology_highlights/semrush_visits_mom_pct","technology_highlights/siftery_num_products","timestamp","total_active_products","type","url","uuid","web_traffic_by_semrush","website"
"Dahua Technology is a world-leading video surveillance solution provider.","42","Hangzhou, Zhejiang, China, Asia","apptopia/app/apptopia_app.908144608.","9066","iDSS","itunes_connect","apptopia/app/apptopia_app.1110241402.","17","大华云商平台","itunes_connect","apptopia/app/apptopia_app.1439167836.com.mm.dss.cloud","2","DSS Cloud","itunes_connect","apptopia/app/apptopia_app.1454658123.com.mm.dahua.dss_meixizhan","0","DSS Mobile For VDP","itunes_connect","apptopia/app/apptopia_app.1630016695.","0","ConfigTool","itunes_connect","apptopia/app/apptopia_app.1590263752.",,"星联智能版","itunes_connect","apptopia/app/apptopia_app.1570955213.",,"云睿连锁","itunes_connect","apptopia/app/apptopia_app.1486286268.",,"大华易消安Plus","itunes_connect","apptopia/app/apptopia_app.1548652327.",,"大华云联","itunes_connect","apptopia/app/apptopia_app.1570955288.",,"云睿社区(物业版)","itunes_connect","9085","-0.455857690464782","web_tech","100","Enterprise Ecommerce","4","0","technology","99","Ericsson","2","0.269230769230769","it_management","98","Incident and Problem Management","1",,"technology","97","NexGen Digital","3","0.154761904761905","enterprise","97","Enterprise Systems Management","1",,"business_service","97","Ticketing Software","1",,"software_dev","95","JFrog","1",,"workplace","95","Atlanta, Georgia","1",,"data_management","94","Open vSwitch (OVS)","1",,"it_management","94","IT Service Management","1",,"2025-11-23","42","Viewport Meta","999962","mobile","IPhone / Mobile Compatible","999957","mobile","SSL by Default","854395","ssl","U.S. Server Location","764240","hosting","HSTS","763927","ssl","Apple Mobile Web Clips Icon","759892","mobile","DNSSEC","747281","ns","Global Site Tag","470629","analytics","Apache","431866","web_server","Office 365 Mail","343719","mx","42","Viewport Meta","999962","mobile","IPhone / Mobile Compatible","999957","mobile","SSL by Default","854395","ssl","U.S. Server Location","764240","hosting","HSTS","763927","ssl","Apple Mobile Web Clips Icon","759892","mobile","DNSSEC","747281","ns","Global Site Tag","470629","analytics","Apache","431866","web_server","Office 365 Mail","343719","mx","34865","98%","dahua-technology","Video","Dahua Technology is a world-leading video surveillance solution provider.","for_profit","overseas@dahuatech.com","+8657187688883","Executive President","Zhang Xingming","Senior Vice President","Wu Jian","Senior Vice President","Jiang Xiaolai","Senior Vice President","Zhu Jiantang","Vice President","Song Ke","Senior Vice President","Zhao Yuning","Vice President","Wu Jun","Vice President","Liu Ming","China","Zhang Xingming","zhang-xingming","Executive President","Wu Jian","wu-jian-0a17","Senior Vice President","Jiang Xiaolai","jiang-xiaolai","Senior Vice President","Zhu Jiantang","zhu-jiantang","Senior Vice President","Song Ke","song-ke-60d8","Vice President","Zhao Yuning","zhao-yuning","Senior Vice President","Wu Jun","wu-jun-cbc7","Vice President","Liu Ming","liu-ming-6f54","Vice President","overseas@dahuatech.com","USD","$44.70B","44697079341","44697079341","854","663","Zhejiang Public Companies","USD","$1.10T","1104176256996","1104176256996","6398","7521","Asia-Pacific (APAC) Public Companies With More Than $50M in Revenue","USD","$1.46T","1458815629995","1458815629995","9947","21105","Asia-Pacific (APAC) Investors (Top 10K)","USD","$31.15B","31151471208","31151471208","5917","2743","Asia Security Companies","1","1","fu-fiquan","person","Fu Fiquan","Dahua Technology is a world-leading video surveillance solution provider. Their company enjoys the world’s second largest market share according to the IHS 2015 report, and 5th ranking of a&s Security 50 in 2015. They believe on investing and building strong R&D capabilities for new technology and innovation. Their company invests almost 10% of sales revenue every year. They have more than 3000 professionals in their R&D team, dedicated to providing cutting edge products with high quality and performance. Dahua’s solutions are designed to be scalable and modular to provide flexible configuration options. Their company has a patent portfolio with 592 patents and they license their technology to other manufacturers. Meanwhile, numerous Dahua products have been acknowledged and awarded by professional associations and organizations in security industry.
 
Their company’s product portfolio includes: Advanced Video Surveillance Equipment and Software, Access Control Hardware and Software, Intrusion Hardware, and Intelligent Building Management Systems.
 
Dahua’s products are widely used in many fields, such as banking, public security, energy infrastructure, telecommunication, intelligent-building, and intelligent-transportation. Many significant projects have been installed with Dahua’s solutions including: Lulu mall in Oman, Luxury hotel in Italy, Peruvian LAN airline, APEC in China and Safe city in Brazil as well as many others.
 
Dahua has established sales, marketing and service networks globally. Their company has offices in mainland China, greater Asia, the Americas, Europe, Oceania, Africa and others. Their global footprint makes responding to the market with the best service and products possible.","dahua-technology-invested-in-renxin-technology-series-a--bf66fa73--64395eca","investment","Dahua Technology investment in Series A - Renxin Technology","dahua-technology-invested-in-adjoint-inc-series-a--549db781--dda670c0","investment","Dahua Technology investment in Series A - Adjoint","dahua-technology-invested-in-maycur-com-series-a--7c08a34b--d085c7a9","investment","Dahua Technology investment in Series A - MAYCUR.COM","73","-20","asia-pacific","Asia-Pacific (APAC)","82","2","Asia","dahua-technology","https://images.crunchbase.com/image/upload/c_pad,h_170,w_170,f_auto,b_white,q_auto:eco,dpr_4/v1464863340/ibn7hxhnlpthsvbmry5t.png","information-technology-dbca","Information Technology","security-4c60","Security","video","Video","https://www.crunchbase.com/organization/dahua-technology","renxin-technology-series-a--bf66fa73","wx8ytfpaaryz7rba6ayx","funding_round","Series A - Renxin Technology","dahua-technology-invested-in-renxin-technology-series-a--bf66fa73--64395eca",,"renxin-technology","wx8ytfpaaryz7rba6ayx","organization","Renxin Technology","investment","Dahua Technology investment in Series A - Renxin Technology","adjoint-inc-series-a--549db781","hmrb8efpoee3xqjyz6mw","funding_round","Series A - Adjoint","dahua-technology-invested-in-adjoint-inc-series-a--549db781--dda670c0",,"adjoint-inc","hmrb8efpoee3xqjyz6mw","organization","Adjoint","investment","Dahua Technology investment in Series A - Adjoint","maycur-com-series-a--7c08a34b","c4d9f682c125e874da39","funding_round","Series A - MAYCUR.COM","dahua-technology-invested-in-maycur-com-series-a--7c08a34b--d085c7a9","false","maycur-com","c4d9f682c125e874da39","organization","MAYCUR.COM","investment","Dahua Technology investment in Series A - MAYCUR.COM","dahua-technology-post-ipo-equity--99729e7d","v1464863340/ibn7hxhnlpthsvbmry5t.png","funding_round","Post-IPO Equity - Dahua Technology","china-mobile-invested-in-dahua-technology-post-ipo-equity--99729e7d--bd6b1627","china-mobile","v1397183570/c01f4ef541f27f50d5fb4530b96df088.png","organization","China Mobile","true","investment","China Mobile investment in Post-IPO Equity - Dahua Technology","https://www.google.com/finance?q=SZSE:002236","SZSE:002236","public","523","36","c9","Computer and Software Products and Electrical and Scientific Products","Zhejiang Dahua Technology Co., Ltd","Hangzhou","hangzhou-zhejiang","Zhejiang","zhejiang-china","China","china-500a","Asia","asia","353615","-0.224208664975911","Dahua Technology","2025-11-12","Dahua Technology","2025-11-12","Dahua Technology","2025-11-12","Dahua Technology","2025-11-03","Dahua Technology","2025-11-03","Dahua Technology","2025-11-03","Dahua Technology","2025-10-29","Dahua Technology","2025-10-28","Dahua Technology","2025-10-28","Dahua Technology","2025-10-15","Dahua Technology","14","10001+","3","1","14","1","3","1","active","14","+8657187688883","Devices capturing video footage for security monitoring, including network cameras, dome cameras, and specialized cameras for various environments.","Video Surveillance Cameras","Cameras and devices that detect heat signatures for observation and temperature measurement in security and industrial applications.","Thermal Imaging Products","Hardware for recording, storing, and managing video data, including network video recorders, storage servers, and SD cards.","Video Recorders and Storage Solutions","Display units including LCD video walls, security monitors, office monitors, and interactive smart screens for video and data visualization.","Display and Visualization Products","Devices and platforms for decoding, controlling, and managing video and security systems, including decoders, keyboards, and integrated control platforms.","Control and Management Systems","Networking equipment and security devices including switches, routers, wireless products, and security gateways for data transmission and network protection.","Network and Communication Products","Zhejiang","2025-11-17","353615","-0.224208664975911","using","Microsoft Outlook","not_using","DigiCert","using","GlobalSign","using","Office 365","https://www.crunchbase.com/organization/lianzhang-menhu","Lianzhang Menhu","https://www.crunchbase.com/organization/shanghai-produce-media-system","Shanghai Produce Media System","https://www.crunchbase.com/organization/nuuo-154c","NUUO","https://www.crunchbase.com/organization/cristal-srl","Cristal SRL","https://www.crunchbase.com/organization/comnet-cni","Comnet-cni","https://www.crunchbase.com/organization/elite-infotech","Elite Infotech","https://www.crunchbase.com/organization/cctv-dubai","CCTV Dubai","https://www.crunchbase.com/organization/q2-technologies","Q2 Technologies","https://www.crunchbase.com/organization/u-fairy-g-r-iot-tech","U-Fairy G.R. IoT Tech","https://www.crunchbase.com/organization/neo-it-solutions","Neo IT Solutions","https://www.twitter.com/dahuasecurity","https://www.twitter.com/dahuasecurity","42","353615","-0.224208664975911","4","2025-12-02T13:52:36.056Z","4","company","https://www.crunchbase.com/organization/dahua-technology","3660580d-7307-62b6-1354-0b8ee9eded62",,"https://www.dahuatech.com"
